folderName,zipFilename,filename,access,provenance,title,title,date,date,originator,originator,originator,description,description,language,publisher,publisher,publisher,subject,subject,collectionTitle,collectionTitle,spatialSubject,spatialSubject,useLimitation,useLimitation,accessConst,useConst,otherConst,useLimitation,license,rightsHolder,type,isPartOf,source,replaces,isReplacedBy,isVersionOf,relation,dateIssued,temporalCoverage,rights,schemaVersion,suppressed
3853-a5_2013_a4,3853-a5_2013_a4.zip,S:\Projects\Acquisitions\_4 createISOMetadata\NEW STRUCTURE\_5 metadataPrep\Test_Unmodified\3853-a5_2013_a4\Parcels.shp,Public,UC Santa Barbara,Parcels,"Parcels, Amador County, California, 2013",,2013,,Amador County GIS Division,Amador County GIS Division,Amador County Assessor Parcel Data,"This polygon shapefile represents tax parcel data in Amador County for 2013.  This file was downloaded 2013 by UCSB Library staff.  It was originally available via [source].

The following metadata was provided by the data creators:  Amador County Assessor Parcel Data",eng,,,Amador County GIS Division,Parcels,Real property,,Amador County GIS data,,Amador County|CA,"The County of Amador assumes no responsibility arising from use of this data set. THIS DATA SET IS PROVIDED WITHOUT WARRANTY OF ANY KIND, expressed or implied, including but not limited to, the implied warranties of merchantability and fitness for a particular purpose. Do not make any business decisions based on this data set before validating your decision with the appropriate County Office.",,,,,,,,,,,,,,,,,,,
3853-h8_2013_h8,3853-h8_2013_h8.zip,S:\Projects\Acquisitions\_4 createISOMetadata\NEW STRUCTURE\_5 metadataPrep\Test_Unmodified\3853-h8_2013_h8\apnhum47sp.shp,Public,UC Santa Barbara,apnhum47sp,"Parcels, Humboldt County, California, 2013",,2013,,Humboldt County Planning & Building,Humboldt County Planning & Building,"Humboldt County's Parcel Layer Version 4.7. This dataset is the result of an ongoing effort to produce an accurate county wide parcel layer. Digitizing began as far back as 1996. Includes all unincorporated areas as well as cities/incorporated areas. Cities data obtained from Arcata, Eureka, and Trinidad. Please note the accuracy of GIS map data varies from location to location in the County. This GIS system is useful for planning purposes but should not be relied upon to determine property, zoning or general plan designation boundaries or be used in any way for project design. All GIS data should be verified before it is materially relied upon for property or project planning.","This polygon shapefile represents tax parcel data in Humboldt County for 2013.  This file was downloaded 2013 by UCSB Library staff.  It was originally available via [source].

The following metadata was provided by the data creators:  Humboldt County's Parcel Layer Version 4.7. This dataset is the result of an ongoing effort to produce an accurate county wide parcel layer. Digitizing began as far back as 1996. Includes all unincorporated areas as well as cities/incorporated areas. Cities data obtained from Arcata, Eureka, and Trinidad. Please note the accuracy of GIS map data varies from location to location in the County. This GIS system is useful for planning purposes but should not be relied upon to determine property, zoning or general plan designation boundaries or be used in any way for project design. All GIS data should be verified before it is materially relied upon for property or project planning.",eng,,,Humboldt County Planning & Building,Parcels|Ownership|Existing Land Use,Real property,,Humboldt County GIS data,,Humboldt County|CA,"To be used for planning purposes as general guide to parcel lines within Humboldt County. Should not be used for boundary delineation or project design. Humboldt County Planning and Building Department makes no guarantee of the accuracy or completeness of this data. It has not been fully reviewed for accuracy and is intended to be used for planning purposes only. Humboldt County Planning and Building Department assumes no liability or responsibility in the use, or misuse, of this data. While every effort has been made to assure the accuracy of this information, it should be understood that it does not have the force and effect of law, rule, or regulation. Should any difference or error occur, the law will take precedence.",****THIS DATA IS NOT TO BE DISTRUBITED WITHOUT THE CONSENT OF HUMBOLDT COUNTY PLANNING & BUILDING DEPARTMENT****** (see contact info below). This data should be used for planning purposes only. Humboldt County Planning and Building Department makes no guarantee of the accuracy or completeness of this data set. It has not been fully reviewed for accuracy and is intended to be used for planning purposes only. Humboldt County Planning and Building Department assumes no liability or responsibility in the use of this data.,,,,,,,,,,,,,,,,,,
3853-k4_2013_k4,3853-k4_2013_k4.zip,S:\Projects\Acquisitions\_4 createISOMetadata\NEW STRUCTURE\_5 metadataPrep\Test_Unmodified\3853-k4_2013_k4\kern_parcels_land_2013final.shp,Public,UC Santa Barbara,Kern County GIS Tax Parcels (Land) 2013 Final,"Parcels, Kern County, California, 2013",,2013,,"Kern County Assessor's Office, Mapping Section.","Kern County Assessor's Office, Mapping Section","This feature class contains ""land"" (surface rights) parcel boundaries delineated for property tax assessment purposes. This data includes all private (taxable), state utility, and other governmental (tax exempt) land parcels listed on the secured tax roll, but does not include mineral rights (subsurface) parcels, mobilehomes, or unsecured taxable entities. Parcels are modeled as planimetric polygons in a seamless fabric comprising the spatial extent of the County of Kern, in the State of California.","This polygon shapefile represents tax parcel data in Kern County for 2013.  This file was downloaded 2013 by UCSB Library staff.  It was originally available via [source].

The following metadata was provided by the data creators:  This feature class contains ""land"" (surface rights) parcel boundaries delineated for property tax assessment purposes. This data includes all private (taxable), state utility, and other governmental (tax exempt) land parcels listed on the secured tax roll, but does not include mineral rights (subsurface) parcels, mobilehomes, or unsecured taxable entities. Parcels are modeled as planimetric polygons in a seamless fabric comprising the spatial extent of the County of Kern, in the State of California.",eng,,,"Kern County Assessor's Office, Mapping Section",apn|land|assessor|lot|parcel|cadastre|assessment|tax|property|surface|ownership|cadastral,Real property,,Kern County GIS data,Ridgecrest|Maricopa|Shafter|McFarland|San Joaquin Valley|Arvin|Bakersfield|Delano|Wasco|California City|California|Taft|Tehachapi|Kern,Kern County|CA,Refer to the disclaimer statement in the 'Access Constraints' element of the 'Identification Information' section of this document.,Refer to the disclaimer statement in the 'Access Constraints' element of the 'Identification Information' section of this document.,,,"SUMMARY: This disclaimer statement requires the data recipient to receive the data ""as is"" with no warranty, and to hold all data providers not liable for any losses or damages caused by, or resulting from, use of the data. The statement also requires the data recipient to not distribute any portion of the data without a copy of this disclaimer statement. Whereas the Kern Geographic Information Network (Kern GEONET) and its members and other agencies have developed digital geographic data herein referred to as ""the Data."" Whereas the entity or entities acquiring a copy of the Data are herein referred to as ""the Recipient."" Whereas the Kern Geographic Information Network and its members, the County of Kern, and other agencies that have developed and contributed the Data which is being transmitted to the Recipient by these agencies are herein referred to as ""the Data Providers."" I. DISCLAIMER OF LIABILITY AND WARRANTIES: A. The Recipient understands and agrees that it is possible that errors and omissions will occur in data input or programming done by the Data Providers to provide the data in the form desired. The Recipient further understands and agrees that it is probable that errors and omissions will occur in record keeping processes, especially when large numbers of records are developed and maintained, and that data may not meet the Recipient's standards as to accuracy or completeness. Notwithstanding, the Recipient agrees to take the data ""as is"", fully expecting that there may be errors and omissions associated with the data. B. The Recipient further understands and agrees that the Data Providers make absolutely no warranty whatsoever, whether expressed or implied, as to the accuracy, thoroughness, value, quality, validity, merchantability, suitability, condition or fitness for a particular purpose of the data or any programming used to obtain the data, nor as to whether the data are error-free, up-to-date, complete or based upon accurate or meaningful facts. C. The Recipient further understands and agrees that it will forever waive any and all rights, claims, causes of action or other recourse that it might otherwise have against the Data Providers for any injuries or damages of any type, whether direct, indirect, incidental, consequential or otherwise, resulting from any error or omission in the data or in any programming used to obtain the data, or in any manner arising out of or related to this agreement or the data provided hereunder. The Recipient agrees that the Data Providers shall not be liable to the Recipient for any liability, claim, loss, damage, injury or expense of any kind caused or alleged to be caused, directly or indirectly, by the inadequacy of data obtained from the Data Providers, by any deficiency of the Data Providers or the Recipient systems, by any delay or failure to provide any service, or by any other interruption, disruption or loss of the Recipient operations. II. INDEMNIFICATION: A. The Recipient agrees that it will provide no copy or partial copy of any data to any other party, including consultants under contract with The Recipient, without disclosing that the copy or partial copy was obtained from the Data Providers and without attaching the Disclaimer of Liability and Warranties paragraph. B. The Recipient hereby agrees to defend, save, hold harmless and indemnify the Data Providers and signatories to its data sharing agreements and its/their officers, employees and agents against claims by anyone for any loss, injury, damage, risk, cause of action, or liability of any type (including legal fees) incurred by the Recipient or any other person, relating to or arising out of the subject matter of this agreement, or which may be alleged to have been caused, either directly or indirectly, by the acts, conduct, omissions, negligence or lack of good faith of the Data Providers, their officers, agents or employees.",,,,,,,,,,,,,,,
3853-s24_2016_s2_Lots,3853-s24_2016_s2_Lots.zip,S:\Projects\Acquisitions\_4 createISOMetadata\NEW STRUCTURE\_5 metadataPrep\Test_Unmodified\3853-s24_2016_s2_Lots\LOTS.shp,Public,UC Santa Barbara,LOTS,"Lots, San Diego County, California, 2016",1/4/2016,2016,,,San Diego County,"The dataset consists of polygons (boundaries) representing legally subdivided lots in the County of San Diego. A lot is a piece of ground that has been legally created. A lot defines ownership and indicates that the property was created as a legal subdivision of land. For example, lots may be the individual lots created from a recorded subdivsion map or a government lot (section/township/range) subdivided by deed document. Lots are not parcels. Tax parcels are created for the purposes of assessing property taxes. In many cases the (tax) parcel and the lot will be the same. However, a single lot may have more than one tax parcel. Lots generally require a review by the County or City to determine if they are buildable lots or not. Tax parcels are created by the County Assessor to define tax rates.The SanGIS lot layer is under constant revsions and, unlike the parcel layer, it is not a complete set of all legal lots in the County.","This polygon shapefile represents tax parcel data in San Diego County for 2013.  This file was downloaded 2016 by UCSB Library staff.  It was originally available via [source].

The following metadata was provided by the data creators:  The dataset consists of polygons (boundaries) representing legally subdivided lots in the County of San Diego. A lot is a piece of ground that has been legally created. A lot defines ownership and indicates that the property was created as a legal subdivision of land. For example, lots may be the individual lots created from a recorded subdivsion map or a government lot (section/township/range) subdivided by deed document. Lots are not parcels. Tax parcels are created for the purposes of assessing property taxes. In many cases the (tax) parcel and the lot will be the same. However, a single lot may have more than one tax parcel. Lots generally require a review by the County or City to determine if they are buildable lots or not. Tax parcels are created by the County Assessor to define tax rates.The SanGIS lot layer is under constant revsions and, unlike the parcel layer, it is not a complete set of all legal lots in the County.",eng,,,San Diego County,"Lots, County of San Diego, Property Boundaires, Subdivsion",Real property,,San Diego County GIS data,"California, County of San Diego, Carlsbad, Coronado, Chula Vista, Del Mar, El Cajon, Encinitas, Escondido, Imperial Beach, Lemon Grove, La Mesa, National City, Oceanside, Poway, San Diego, San Marcos, Solana Beach, Santee, Vista",San Diego County|CA,Data is generalized and created for use in regional projects. Please refer to SanGIS GIS data end user use agreement and disclaimer which is available at the following: http://www.sangis.org/Legal_Notice.htm.The LOT layer is incomplete. It does not contain all legally subdivided lots in the County. The layer is constantly under revision.,,,,"IMPORTANT READ THESE TERMS CAREFULLY BEFORE USING THIS DIGITAL DATA! Data Agreement and Disclaimer This data is collected from various sources and will change over time without notice. In using the data, users should be aware that some of these data are generalized and not parcel based, and were created for use in regional projects. While SanGIS believes the data is accurate and properly functioning, SanGIS disclaims any responsibility for the accuracy or correctness of the data. This data is provided on an ""AS IS"", ""AS AVAILABLE"" and ""WITH ALL FAULTS"" basis. SanGIS makes no warranties, express or implied, including but not limited to any warranties of merchantability or fitness for a particular purpose, nor shall the distribution of this information constitute any warranty. In no event shall SanGIS become liable to users of these data, or any other party, for any loss or damages, consequential or otherwise, including but not limited to time, money, or goodwill, arising from the use, operation or modification of the data. In using these data, you further agree to indemnify, defend, and hold harmless SanGIS for any and all liability of any nature arising out of or resulting from the lack of accuracy or correctness of the data, or the use of the data. To ensure that appropriate documentation and data limitations are provided, re-distribution of this data is strongly discouraged. Please acknowledge SanGIS as a source when SanGIS data are used in the preparation of reports, papers, publications, maps, and other products. This Agreement shall be construed in accordance with the laws of the United States and the State of California. Venue shall rest solely in the County of San Diego, State of California.",,,,,,,,,,,,,,,
